{
  "$schema": "https://json-schema.org/draft/2020-12/schema",
  "$id": "https://smt-line.local/contracts/v1/mqtt_run.schema.json",
  "title": "I3 smt/v1/<site>/run",
  "type": "object",
  "required": [
    "v",
    "msg_id",
    "run_id",
    "ts",
    "sim_time_s",
    "epoch",
    "speed_factor",
    "seed",
    "scenario",
    "lines"
  ],
  "properties": {
    "v": {
      "const": 1
    },
    "msg_id": {
      "type": "string",
      "minLength": 1
    },
    "run_id": {
      "type": "string",
      "minLength": 1
    },
    "ts": {
      "type": "string",
      "pattern": "^\\d{4}-\\d{2}-\\d{2}T\\d{2}:\\d{2}:\\d{2}\\.\\d{3}Z$"
    },
    "sim_time_s": {
      "type": "number",
      "minimum": 0
    },
    "epoch": {
      "type": "string",
      "pattern": "^\\d{4}-\\d{2}-\\d{2}T\\d{2}:\\d{2}:\\d{2}\\.\\d{3}Z$"
    },
    "speed_factor": {
      "type": "number",
      "minimum": 0
    },
    "seed": {
      "type": [
        "integer",
        "null"
      ]
    },
    "scenario": {
      "type": [
        "string",
        "null"
      ]
    },
    "lines": {
      "type": "array",
      "minItems": 1,
      "items": {
        "type": "string",
        "pattern": "^line[0-9]+$"
      }
    }
  }
}
